{
  "id": "synthetic-hvac-001",
  "name": "Illustrative HVAC Company",
  "industry": "HVAC",
  "currency": "USD",
  "model_version": "mvp-1.0",
  "valuation_month": 60,
  "horizon_months": 60,
  "forecast_start_month_of_year": 1,
  "historical_months": [
    {
      "month_of_year": 1,
      "service_jobs": 540,
      "service_revenue": 351000,
      "other_revenue": 65666.66666666667,
      "revenue": 416666.6666666667,
      "tech_direct_labor": 95000,
      "vehicle_direct_opex": 15000,
      "service_variable_cost": 91666.66666666667,
      "other_direct_cost": 27500,
      "cogs": 229166.66666666666,
      "operating_overhead": 125000,
      "ebitda": 62500
    },
    {
      "month_of_year": 2,
      "service_jobs": 540,
      "service_revenue": 351000,
      "other_revenue": 65666.66666666667,
      "revenue": 416666.6666666667,
      "tech_direct_labor": 95000,
      "vehicle_direct_opex": 15000,
      "service_variable_cost": 91666.66666666667,
      "other_direct_cost": 27500,
      "cogs": 229166.66666666666,
      "operating_overhead": 125000,
      "ebitda": 62500
    },
    {
      "month_of_year": 3,
      "service_jobs": 540,
      "service_revenue": 351000,
      "other_revenue": 65666.66666666667,
      "revenue": 416666.6666666667,
      "tech_direct_labor": 95000,
      "vehicle_direct_opex": 15000,
      "service_variable_cost": 91666.66666666667,
      "other_direct_cost": 27500,
      "cogs": 229166.66666666666,
      "operating_overhead": 125000,
      "ebitda": 62500
    },
    {
      "month_of_year": 4,
      "service_jobs": 540,
      "service_revenue": 351000,
      "other_revenue": 65666.66666666667,
      "revenue": 416666.6666666667,
      "tech_direct_labor": 95000,
      "vehicle_direct_opex": 15000,
      "service_variable_cost": 91666.66666666667,
      "other_direct_cost": 27500,
      "cogs": 229166.66666666666,
      "operating_overhead": 125000,
      "ebitda": 62500
    },
    {
      "month_of_year": 5,
      "service_jobs": 540,
      "service_revenue": 351000,
      "other_revenue": 65666.66666666667,
      "revenue": 416666.6666666667,
      "tech_direct_labor": 95000,
      "vehicle_direct_opex": 15000,
      "service_variable_cost": 91666.66666666667,
      "other_direct_cost": 27500,
      "cogs": 229166.66666666666,
      "operating_overhead": 125000,
      "ebitda": 62500
    },
    {
      "month_of_year": 6,
      "service_jobs": 540,
      "service_revenue": 351000,
      "other_revenue": 65666.66666666667,
      "revenue": 416666.6666666667,
      "tech_direct_labor": 95000,
      "vehicle_direct_opex": 15000,
      "service_variable_cost": 91666.66666666667,
      "other_direct_cost": 27500,
      "cogs": 229166.66666666666,
      "operating_overhead": 125000,
      "ebitda": 62500
    },
    {
      "month_of_year": 7,
      "service_jobs": 540,
      "service_revenue": 351000,
      "other_revenue": 65666.66666666667,
      "revenue": 416666.6666666667,
      "tech_direct_labor": 95000,
      "vehicle_direct_opex": 15000,
      "service_variable_cost": 91666.66666666667,
      "other_direct_cost": 27500,
      "cogs": 229166.66666666666,
      "operating_overhead": 125000,
      "ebitda": 62500
    },
    {
      "month_of_year": 8,
      "service_jobs": 540,
      "service_revenue": 351000,
      "other_revenue": 65666.66666666667,
      "revenue": 416666.6666666667,
      "tech_direct_labor": 95000,
      "vehicle_direct_opex": 15000,
      "service_variable_cost": 91666.66666666667,
      "other_direct_cost": 27500,
      "cogs": 229166.66666666666,
      "operating_overhead": 125000,
      "ebitda": 62500
    },
    {
      "month_of_year": 9,
      "service_jobs": 540,
      "service_revenue": 351000,
      "other_revenue": 65666.66666666667,
      "revenue": 416666.6666666667,
      "tech_direct_labor": 95000,
      "vehicle_direct_opex": 15000,
      "service_variable_cost": 91666.66666666667,
      "other_direct_cost": 27500,
      "cogs": 229166.66666666666,
      "operating_overhead": 125000,
      "ebitda": 62500
    },
    {
      "month_of_year": 10,
      "service_jobs": 540,
      "service_revenue": 351000,
      "other_revenue": 65666.66666666667,
      "revenue": 416666.6666666667,
      "tech_direct_labor": 95000,
      "vehicle_direct_opex": 15000,
      "service_variable_cost": 91666.66666666667,
      "other_direct_cost": 27500,
      "cogs": 229166.66666666666,
      "operating_overhead": 125000,
      "ebitda": 62500
    },
    {
      "month_of_year": 11,
      "service_jobs": 540,
      "service_revenue": 351000,
      "other_revenue": 65666.66666666667,
      "revenue": 416666.6666666667,
      "tech_direct_labor": 95000,
      "vehicle_direct_opex": 15000,
      "service_variable_cost": 91666.66666666667,
      "other_direct_cost": 27500,
      "cogs": 229166.66666666666,
      "operating_overhead": 125000,
      "ebitda": 62500
    },
    {
      "month_of_year": 12,
      "service_jobs": 540,
      "service_revenue": 351000,
      "other_revenue": 65666.66666666667,
      "revenue": 416666.6666666667,
      "tech_direct_labor": 95000,
      "vehicle_direct_opex": 15000,
      "service_variable_cost": 91666.66666666667,
      "other_direct_cost": 27500,
      "cogs": 229166.66666666666,
      "operating_overhead": 125000,
      "ebitda": 62500
    }
  ],
  "opening_financial_state": {
    "cash": 400000,
    "accounts_receivable": 416666.6666666667,
    "inventory": 50000,
    "accounts_payable": 59583.333333333336,
    "debt_tranches": [
      {
        "id": "existing-debt-01",
        "principal": 1200000,
        "annual_interest_rate": 0.08,
        "remaining_term_months": 60,
        "monthly_principal": 20000,
        "first_repayment_month": 1,
        "amortization_policy": "level_principal"
      }
    ],
    "depreciable_assets": [
      {
        "id": "existing-assets-01",
        "cost_basis": 900000,
        "accumulated_depreciation": 150000,
        "monthly_depreciation": 12500,
        "remaining_life_months": 60,
        "in_service_month": 0
      }
    ]
  },
  "operations": {
    "technicians": 12,
    "vehicles": 12,
    "working_days_per_month": 20,
    "max_jobs_per_tech_per_day": 3,
    "max_jobs_per_vehicle_per_day": 3,
    "base_monthly_job_demand": 540,
    "average_ticket": 650,
    "non_service_revenue_per_month": 65666.66666666667,
    "technician_loaded_cost_per_year": 95000,
    "vehicle_opex_per_year": 15000,
    "service_variable_cost_rate": 0.2611585944919278,
    "non_service_direct_cost_per_month": 27500,
    "fixed_overhead_per_month": 125000,
    "baseline_marketing_in_overhead": 10000
  },
  "global_assumptions": {
    "organic_demand_growth": 0.02,
    "wage_inflation": 0.03,
    "overhead_inflation": 0.02,
    "ticket_growth": 0.02,
    "other_revenue_growth": 0,
    "other_direct_cost_growth": 0,
    "collection_delay_months": 1,
    "payment_delay_months": 0.5,
    "ap_eligible_cost_categories": [
      "service_variable_cost",
      "other_direct_cost"
    ],
    "constant_inventory": 50000,
    "existing_depreciation_per_year": 150000,
    "maintenance_capex_per_year": 100000,
    "truck_useful_life_months": 60,
    "tax_rate": 0.25,
    "liquidity_floor": 150000,
    "valuation_multiple": 6,
    "seasonality": [
      1,
      1,
      1,
      1,
      1,
      1,
      1,
      1,
      1,
      1,
      1,
      1
    ],
    "distribution_parameters": {}
  },
  "provenance": {
    "/id": {
      "kind": "assumed",
      "source": "docs/assumptions.md: proposed fixture inputs; spec §§3.1–3.4",
      "unit": "label"
    },
    "/name": {
      "kind": "assumed",
      "source": "docs/assumptions.md: proposed fixture inputs; spec §§3.1–3.4",
      "unit": "label"
    },
    "/industry": {
      "kind": "assumed",
      "source": "docs/assumptions.md: proposed fixture inputs; spec §§3.1–3.4",
      "unit": "label"
    },
    "/currency": {
      "kind": "assumed",
      "source": "docs/assumptions.md: proposed fixture inputs; spec §§3.1–3.4",
      "unit": "label"
    },
    "/model_version": {
      "kind": "assumed",
      "source": "docs/assumptions.md: proposed fixture inputs; spec §§3.1–3.4",
      "unit": "label"
    },
    "/valuation_month": {
      "kind": "assumed",
      "source": "docs/assumptions.md: proposed fixture inputs; spec §§3.1–3.4",
      "unit": "months"
    },
    "/horizon_months": {
      "kind": "assumed",
      "source": "docs/assumptions.md: proposed fixture inputs; spec §§3.1–3.4",
      "unit": "months"
    },
    "/forecast_start_month_of_year": {
      "kind": "assumed",
      "source": "docs/assumptions.md: proposed fixture inputs; spec §§3.1–3.4",
      "unit": "calendar_month_index"
    },
    "/historical_months/0/month_of_year": {
      "kind": "synthetic_historical",
      "source": "Spec §3.4 synthetic annual reference; flat monthly allocation",
      "unit": "calendar_month_index"
    },
    "/historical_months/0/service_jobs": {
      "kind": "synthetic_historical",
      "source": "Spec §3.4 synthetic annual reference; flat monthly allocation",
      "unit": "jobs/month"
    },
    "/historical_months/0/service_revenue": {
      "kind": "synthetic_historical",
      "source": "Spec §3.4 synthetic annual reference; flat monthly allocation",
      "unit": "USD"
    },
    "/historical_months/0/other_revenue": {
      "kind": "synthetic_historical",
      "source": "Spec §3.4 synthetic annual reference; flat monthly allocation",
      "unit": "USD"
    },
    "/historical_months/0/revenue": {
      "kind": "synthetic_historical",
      "source": "Spec §3.4 synthetic annual reference; flat monthly allocation",
      "unit": "USD"
    },
    "/historical_months/0/tech_direct_labor": {
      "kind": "synthetic_historical",
      "source": "Spec §3.4 synthetic annual reference; flat monthly allocation",
      "unit": "USD"
    },
    "/historical_months/0/vehicle_direct_opex": {
      "kind": "synthetic_historical",